{
  "kind": "infrawright.adoption_catalog",
  "product": "zcc",
  "provider": {
    "name": "zcc",
    "source": "zscaler/zcc",
    "version": "0.1.0-beta.1"
  },
  "resources": [
    {
      "identity": {
        "constant_key": null,
        "identity_fields": {},
        "identity_renames": {},
        "import_id": {
          "segments": [
            {
              "field": "id"
            }
          ],
          "template": "{id}"
        },
        "key_fields": [
          "id"
        ],
        "skip_if": [],
        "skip_if_lte": []
      },
      "lookup_source": null,
      "projection": {
        "attributes": {
          "active": {
            "encoding": "bool",
            "provider_sensitive": false,
            "status": "optional"
          },
          "auto_purge_days": {
            "encoding": "number",
            "provider_sensitive": false,
            "status": "optional"
          },
          "auto_removal_days": {
            "encoding": "number",
            "provider_sensitive": false,
            "status": "optional"
          },
          "device_exceed_limit": {
            "encoding": "number",
            "provider_sensitive": false,
            "status": "optional"
          },
          "force_remove_type": {
            "encoding": "string",
            "provider_sensitive": false,
            "status": "optional"
          }
        },
        "blocks": {},
        "computed_only_attributes": [
          "id"
        ],
        "computed_only_blocks": []
      },
      "type": "zcc_device_cleanup"
    },
    {
      "identity": {
        "constant_key": null,
        "identity_fields": {},
        "identity_renames": {},
        "import_id": {
          "segments": [
            {
              "field": "id"
            }
          ],
          "template": "{id}"
        },
        "key_fields": [
          "id"
        ],
        "skip_if": [],
        "skip_if_lte": []
      },
      "lookup_source": null,
      "projection": {
        "attributes": {
          "active": {
            "encoding": "bool",
            "provider_sensitive": false,
            "status": "optional"
          },
          "captive_portal_web_sec_disable_minutes": {
            "encoding": "number",
            "provider_sensitive": false,
            "status": "optional"
          },
          "enable_captive_portal_detection": {
            "encoding": "bool",
            "provider_sensitive": false,
            "status": "optional"
          },
          "enable_fail_open": {
            "encoding": "bool",
            "provider_sensitive": false,
            "status": "optional"
          },
          "enable_strict_enforcement_prompt": {
            "encoding": "bool",
            "provider_sensitive": false,
            "status": "optional"
          },
          "enable_web_sec_on_proxy_unreachable": {
            "encoding": "bool",
            "provider_sensitive": false,
            "status": "optional"
          },
          "enable_web_sec_on_tunnel_failure": {
            "encoding": "bool",
            "provider_sensitive": false,
            "status": "optional"
          },
          "strict_enforcement_prompt_delay_minutes": {
            "encoding": "number",
            "provider_sensitive": false,
            "status": "optional"
          },
          "strict_enforcement_prompt_message": {
            "encoding": "string",
            "provider_sensitive": false,
            "status": "optional"
          },
          "tunnel_failure_retry_count": {
            "encoding": "number",
            "provider_sensitive": false,
            "status": "optional"
          }
        },
        "blocks": {},
        "computed_only_attributes": [
          "id"
        ],
        "computed_only_blocks": []
      },
      "type": "zcc_failopen_policy"
    },
    {
      "identity": {
        "constant_key": null,
        "identity_fields": {},
        "identity_renames": {},
        "import_id": {
          "segments": [
            {
              "field": "id"
            }
          ],
          "template": "{id}"
        },
        "key_fields": [
          "name"
        ],
        "skip_if": [],
        "skip_if_lte": []
      },
      "lookup_source": null,
      "projection": {
        "attributes": {
          "active": {
            "encoding": "bool",
            "provider_sensitive": false,
            "status": "optional"
          },
          "condition_type": {
            "encoding": "number",
            "provider_sensitive": false,
            "status": "optional"
          },
          "dns_search_domains": {
            "encoding": "string",
            "provider_sensitive": false,
            "status": "optional"
          },
          "dns_servers": {
            "encoding": "string",
            "provider_sensitive": false,
            "status": "optional"
          },
          "enable_all_default_adapters_tn": {
            "encoding": "bool",
            "provider_sensitive": false,
            "status": "optional"
          },
          "enable_lwf_driver": {
            "encoding": "bool",
            "provider_sensitive": false,
            "status": "optional"
          },
          "enable_split_vpn_tn": {
            "encoding": "bool",
            "provider_sensitive": false,
            "status": "optional"
          },
          "enable_unified_tunnel": {
            "encoding": "bool",
            "provider_sensitive": false,
            "status": "optional"
          },
          "evaluate_trusted_network": {
            "encoding": "bool",
            "provider_sensitive": false,
            "status": "optional"
          },
          "hostname": {
            "encoding": "string",
            "provider_sensitive": false,
            "status": "optional"
          },
          "name": {
            "encoding": "string",
            "provider_sensitive": false,
            "status": "required"
          },
          "predefined_tn_all": {
            "encoding": "bool",
            "provider_sensitive": false,
            "status": "optional"
          },
          "predefined_trusted_networks": {
            "encoding": "bool",
            "provider_sensitive": false,
            "status": "optional"
          },
          "resolved_ips_for_hostname": {
            "encoding": "string",
            "provider_sensitive": false,
            "status": "optional"
          },
          "skip_trusted_criteria_match": {
            "encoding": "bool",
            "provider_sensitive": false,
            "status": "optional"
          },
          "trusted_dhcp_servers": {
            "encoding": "string",
            "provider_sensitive": false,
            "status": "optional"
          },
          "trusted_egress_ips": {
            "encoding": "string",
            "provider_sensitive": false,
            "status": "optional"
          },
          "trusted_gateways": {
            "encoding": "string",
            "provider_sensitive": false,
            "status": "optional"
          },
          "trusted_network_ids": {
            "encoding": [
              "list",
              "number"
            ],
            "provider_sensitive": false,
            "status": "optional"
          },
          "trusted_network_ids_selected": {
            "encoding": [
              "list",
              "number"
            ],
            "provider_sensitive": false,
            "status": "optional"
          },
          "trusted_networks": {
            "encoding": [
              "list",
              "string"
            ],
            "provider_sensitive": false,
            "status": "optional"
          },
          "trusted_subnets": {
            "encoding": "string",
            "provider_sensitive": false,
            "status": "optional"
          }
        },
        "blocks": {
          "forwarding_profile_actions": {
            "cardinality": "many",
            "nesting_mode": "list",
            "projection": {
              "attributes": {
                "action_type": {
                  "encoding": "number",
                  "provider_sensitive": false,
                  "status": "optional"
                },
                "allow_tls_fallback": {
                  "encoding": "bool",
                  "provider_sensitive": false,
                  "status": "optional"
                },
                "block_unreachable_domains_traffic": {
                  "encoding": "bool",
                  "provider_sensitive": false,
                  "status": "optional"
                },
                "custom_pac": {
                  "encoding": "string",
                  "provider_sensitive": false,
                  "status": "optional"
                },
                "drop_ipv6_include_traffic_in_t2": {
                  "encoding": "bool",
                  "provider_sensitive": false,
                  "status": "optional"
                },
                "drop_ipv6_traffic": {
                  "encoding": "bool",
                  "provider_sensitive": false,
                  "status": "optional"
                },
                "drop_ipv6_traffic_in_ipv6_network": {
                  "encoding": "bool",
                  "provider_sensitive": false,
                  "status": "optional"
                },
                "dtls_timeout": {
                  "encoding": "number",
                  "provider_sensitive": false,
                  "status": "optional"
                },
                "enable_packet_tunnel": {
                  "encoding": "bool",
                  "provider_sensitive": false,
                  "status": "optional"
                },
                "is_same_as_on_trusted_network": {
                  "encoding": "bool",
                  "provider_sensitive": false,
                  "status": "optional"
                },
                "latency_based_server_enablement": {